{
  "format": "omega-validation-plan-1",
  "task": "OM-083",
  "phase": 5,
  "acceptance": "Separação rigorosa entre treino e avaliação",
  "sources": [
    "omega_learning/data_splits.py"
  ],
  "test_files": [
    "testes/acceptance/test_om083.py"
  ],
  "steps": [
    {
      "id": "pytest",
      "kind": "pytest",
      "argv": [
        "{python}",
        "-m",
        "pytest",
        "-q",
        "testes/acceptance/test_om083.py",
        "--junitxml",
        "{junit}"
      ],
      "cwd": ".",
      "resource_profile": "unit"
    }
  ],
  "additional_obligations": [
    "Avaliar retenção, relevância e esquecimento em dados autorizados com separação de treino e avaliação.",
    "Revisão independente obrigatória; um teste aprovado não aceita automaticamente a tarefa."
  ],
  "independent_review_required": true,
  "status": "not_run"
}
