{
  "format": "omega-validation-plan-1",
  "task": "OM-065",
  "phase": 4,
  "acceptance": "Resultados comparados sob orçamento igual",
  "sources": [
    "omega_coder/program_search.py"
  ],
  "test_files": [
    "testes/acceptance/test_om065.py"
  ],
  "steps": [
    {
      "id": "pytest",
      "kind": "pytest",
      "argv": [
        "{python}",
        "-m",
        "pytest",
        "-q",
        "testes/acceptance/test_om065.py",
        "--junitxml",
        "{junit}"
      ],
      "cwd": ".",
      "resource_profile": "unit"
    }
  ],
  "additional_obligations": [
    "Executar tarefas inéditas em worktrees/sandbox e revisar patches e efeitos; não publicar PRs reais durante testes automáticos.",
    "Revisão independente obrigatória; um teste aprovado não aceita automaticamente a tarefa.",
    "Preservar resultados negativos e apresentar avaliação retida, comparação com baseline e custos; o ensaio funcional é insuficiente para o aceite científico."
  ],
  "independent_review_required": true,
  "status": "not_run"
}
