{
  "format": "omega-validation-plan-1",
  "task": "OM-001",
  "phase": 0,
  "acceptance": "CI limpa compila os módulos Lean usados por provas geradas",
  "sources": [
    "omega_selfhost/ProofPrelude.lean",
    "omega_selfhost/proof.py",
    "formal/tensor/lakefile.lean",
    "scripts/setup-native.sh"
  ],
  "test_files": [
    "testes/foundation/test_proof_build.py"
  ],
  "steps": [
    {
      "id": "pytest",
      "kind": "pytest",
      "argv": [
        "{python}",
        "-m",
        "pytest",
        "-q",
        "testes/foundation/test_proof_build.py",
        "--junitxml",
        "{junit}"
      ],
      "cwd": ".",
      "resource_profile": "formal"
    }
  ],
  "additional_obligations": [
    "Reproduzir a matriz Linux limpa, regressão diferencial, fuzzing e sanitizers antes de aceitar a fundação.",
    "Revisão independente obrigatória; um teste aprovado não aceita automaticamente a tarefa."
  ],
  "independent_review_required": true,
  "status": "not_run"
}
