{
  "format": "omega-validation-plan-1",
  "task": "OM-117",
  "phase": 8,
  "acceptance": "Fontes e datas rastreáveis",
  "sources": [
    "omega_tools/web.py"
  ],
  "test_files": [
    "testes/acceptance/test_om117.py"
  ],
  "steps": [
    {
      "id": "pytest",
      "kind": "pytest",
      "argv": [
        "{python}",
        "-m",
        "pytest",
        "-q",
        "testes/acceptance/test_om117.py",
        "--junitxml",
        "{junit}"
      ],
      "cwd": ".",
      "resource_profile": "unit"
    }
  ],
  "additional_obligations": [
    "Validar providers e ambientes reais com permissões explícitas; mocks verificam interfaces e não qualidade perceptiva.",
    "Revisão independente obrigatória; um teste aprovado não aceita automaticamente a tarefa."
  ],
  "independent_review_required": true,
  "status": "not_run"
}
