{
  "format": "omega-validation-plan-1",
  "task": "OM-081",
  "phase": 5,
  "acceptance": "Ganhos em tarefas fora da distribuição de treino",
  "sources": [
    "omega_learning/transfer.py"
  ],
  "test_files": [
    "testes/acceptance/test_om081.py"
  ],
  "steps": [
    {
      "id": "pytest",
      "kind": "pytest",
      "argv": [
        "{python}",
        "-m",
        "pytest",
        "-q",
        "testes/acceptance/test_om081.py",
        "--junitxml",
        "{junit}"
      ],
      "cwd": ".",
      "resource_profile": "unit"
    }
  ],
  "additional_obligations": [
    "Avaliar retenção, relevância e esquecimento em dados autorizados com separação de treino e avaliação.",
    "Revisão independente obrigatória; um teste aprovado não aceita automaticamente a tarefa.",
    "Preservar resultados negativos e apresentar avaliação retida, comparação com baseline e custos; o ensaio funcional é insuficiente para o aceite científico."
  ],
  "independent_review_required": true,
  "status": "not_run"
}
