{
  "format": "omega-validation-plan-1",
  "task": "OM-032",
  "phase": 2,
  "acceptance": "Pré-condições e pós-condições explícitas",
  "sources": [
    "formal/tensor/Omega/GMPContracts.lean",
    "formal/tensor/Omega/RuntimeContracts.lean"
  ],
  "test_files": [
    "testes/acceptance/test_om032.py",
    "testes/lean/OM032.lean"
  ],
  "steps": [
    {
      "id": "pytest",
      "kind": "pytest",
      "argv": [
        "{python}",
        "-m",
        "pytest",
        "-q",
        "testes/acceptance/test_om032.py",
        "--junitxml",
        "{junit}"
      ],
      "cwd": ".",
      "resource_profile": "formal"
    }
  ],
  "additional_obligations": [
    "Compilar Lean e conferir axiomas, hipóteses, enunciados e certificados; provas condicionais não descarregam a implementação C real.",
    "Revisão independente obrigatória; um teste aprovado não aceita automaticamente a tarefa."
  ],
  "independent_review_required": true,
  "status": "not_run"
}
