{
  "format": "omega-validation-plan-1",
  "task": "OM-109",
  "phase": 7,
  "acceptance": "Intervalos de confiança e controle de múltiplas comparações",
  "sources": [
    "omega_evolution/statistics.py"
  ],
  "test_files": [
    "testes/acceptance/test_om109.py"
  ],
  "steps": [
    {
      "id": "pytest",
      "kind": "pytest",
      "argv": [
        "{python}",
        "-m",
        "pytest",
        "-q",
        "testes/acceptance/test_om109.py",
        "--junitxml",
        "{junit}"
      ],
      "cwd": ".",
      "resource_profile": "unit"
    }
  ],
  "additional_obligations": [
    "Exigir evidências independentes de capacidade e segurança, sem autoaprovação ou promoção automática.",
    "Revisão independente obrigatória; um teste aprovado não aceita automaticamente a tarefa.",
    "Preservar resultados negativos e apresentar avaliação retida, comparação com baseline e custos; o ensaio funcional é insuficiente para o aceite científico."
  ],
  "independent_review_required": true,
  "status": "not_run"
}
