{
  "format": "omega-validation-plan-1",
  "task": "OM-012",
  "phase": 1,
  "acceptance": "Programas mal tipados rejeitados antes da execução",
  "sources": [
    "omega/typesystem.py",
    "omega/procedural_types.py",
    "omega_selfhost/driver.py"
  ],
  "test_files": [
    "testes/foundation/test_type_inference.py"
  ],
  "steps": [
    {
      "id": "pytest",
      "kind": "pytest",
      "argv": [
        "{python}",
        "-m",
        "pytest",
        "-q",
        "testes/foundation/test_type_inference.py",
        "--junitxml",
        "{junit}"
      ],
      "cwd": ".",
      "resource_profile": "unit"
    }
  ],
  "additional_obligations": [
    "Comparar backends e programas de referência no subconjunto declarado; revisar limites e compatibilidade da API.",
    "Revisão independente obrigatória; um teste aprovado não aceita automaticamente a tarefa."
  ],
  "independent_review_required": true,
  "status": "not_run"
}
